typ,2024-Q1,2024-Q4,2025-Q1
Liczba zdarzeń zgłoszonych jako wypadki przy pracy rolniczej WYPADKI PRZY PRACY ROLNICZEJ,2581,2243,2342
Liczba zdarzeń uznanych za wypadki przy pracy rolniczej WYPADKI PRZY PRACY ROLNICZEJ,2532,2184,2269
Liczba decyzji przyznających świadczenia WYPADKI PRZY PRACY ROLNICZEJ,2140,1775,1963
w tym śmiertelnych WYPADKI PRZY PRACY ROLNICZEJ,8,12,16
Liczba decyzji odmawiających świadczenia WYPADKI PRZY PRACY ROLNICZEJ,729,600,624
Liczba zarejestrowanych wniosków o jednorazowe odszkodowanie zakończonych wydaniem decyzji CHOROBY ZAWODOWE,60,68,65
Liczba decyzji przyznających świadczenia CHOROBY ZAWODOWE,44,55,51
w tym śmiertelnych CHOROBY ZAWODOWE,1,-,-
Liczba decyzji odmawiających świadczenia CHOROBY ZAWODOWE,15,12,15
